{
  "schemaVersion": "0.2-rc1",
  "taskAttachmentId": "task_se_week03",
  "taskName": "软件工程第3周作业",
  "groupId": "group_se_2026",
  "publishAt": "2026-07-21T10:00:00+08:00",
  "deadlineAt": "2026-07-25T18:00:00+08:00",
  "sourceFilePath": "/demo/source/软件工程第3周作业.pdf",
  "members": [
    {
      "userId": "1000012345",
      "name": "合成成员甲",
      "studentId": "20260001",
      "submissionStatus": "submitted",
      "lastSubmittedAt": "2026-07-22T14:20:00+08:00",
      "filePath": "/demo/submissions/20260001_合成成员甲.docx",
      "reminderStatus": "not_needed",
      "remindedAt": null
    },
    {
      "userId": "1000012346",
      "name": "合成成员乙",
      "studentId": "20260002",
      "submissionStatus": "unsubmitted",
      "lastSubmittedAt": null,
      "filePath": null,
      "reminderStatus": "pending",
      "remindedAt": null
    }
  ],
  "createdAt": "2026-07-21T09:00:00+08:00",
  "updatedAt": "2026-07-22T14:20:00+08:00"
}
